{
  "id": "OD-001",
  "slug": "when-you-wake-up-1",
  "title": "Supplications for when you wake up (1 of 4)",
  "form": "dua",
  "source": {
    "workId": "hisn-al-muslim",
    "workName": "Hisn al-Muslim",
    "entryNumber": "1",
    "citation": "Hisn al-Muslim 1"
  },
  "collections": [
    {
      "id": "when-you-wake-up",
      "name": "Supplications for when you wake up",
      "chapterNumber": 1,
      "entryPosition": 1,
      "entryTotal": 4
    }
  ],
  "blocks": [
    {
      "id": "recitation-1",
      "type": "recitation",
      "label": null,
      "arabic": "الْحَمْدُ للَّهِ الَّذِي أَحْيَانَا بَعْدَ مَا أَمَاتَنَا، وَإِلَيْهِ النُّشُورُ",
      "arabicScript": "imlaei",
      "transliteration": "Al-ḥamdu li-llāhi alladhī aḥyānā baʿda mā amātanā, wa ilayhi an-nushūr",
      "transliterationSource": "open-dua",
      "english": "All praise is for Allah who gave us life after having taken it from us and unto Him is the resurrection.",
      "englishSource": "open-dua",
      "repetition": {
        "count": 1,
        "instruction": null
      },
      "annotations": []
    }
  ],
  "recordings": [
    {
      "id": "recording-1",
      "objectKey": "hisn/v0.0.2/OD-001.mp3",
      "durationSeconds": 16,
      "sampleRateHz": 24000,
      "reciter": "Muhammad Jumah",
      "covers": [
        "recitation-1"
      ]
    }
  ],
  "references": [
    {
      "id": "reference-1",
      "type": "source-note",
      "language": "ar",
      "citation": "البخاري مع الفتح، 11/ 113، برقم 6314، ومسلم، 4/ 2083، برقم 2711."
    }
  ],
  "hadithGrades": [],
  "gradingNote": "Reference as printed in Hisn al-Muslim; grading pending review",
  "tags": [
    "hisn-al-muslim",
    "sleep-and-waking"
  ],
  "reviews": {
    "source": {
      "status": "in-progress",
      "reviewer": null,
      "method": null,
      "date": null
    },
    "translation": {
      "status": "in-progress",
      "reviewer": null,
      "method": null,
      "date": null
    },
    "scholar": {
      "status": "not-started",
      "reviewer": null,
      "method": null,
      "date": null
    },
    "audio": {
      "status": "in-progress",
      "reviewer": null,
      "method": null,
      "date": null
    }
  },
  "revision": 2,
  "rightsProfile": "hisn-open-dua-modern",
  "textHash": "sha256:e2e5b2cd559c7eb9310fd306772e5325ecbd3a03d97ac071254bc1ff5dc5fdf7",
  "mediaHash": "sha256:eb422eb472879778b644d77bb93d2c2ff47ba0373b3bed7d604108c0e196604b",
  "recordHash": "sha256:49bc7e94874bb50c12cde6295771b00e8e0ff692acf8155c63dd4ddd2915ecdb"
}
