{
  "id": "OD-077",
  "slug": "morning-and-evening-3",
  "title": "Words of remembrance for morning and evening (3 of 24)",
  "form": "dua",
  "source": {
    "workId": "hisn-al-muslim",
    "workName": "Hisn al-Muslim",
    "entryNumber": "77",
    "citation": "Hisn al-Muslim 77"
  },
  "collections": [
    {
      "id": "morning-and-evening",
      "name": "Words of remembrance for morning and evening",
      "chapterNumber": 27,
      "entryPosition": 3,
      "entryTotal": 24
    }
  ],
  "blocks": [
    {
      "id": "recitation-1",
      "type": "recitation",
      "label": "Morning",
      "arabic": "أَصْبَحْنَا وَأَصْبَحَ الْمُلْكُ لِلَّهِ ، وَالْحَمْدُ لِلَّهِ، لاَ إِلَهَ إِلاَّ اللَّهُ وَحْدَهُ لاَ شَرِيكَ لَهُ، لَهُ الْمُلْكُ وَلَهُ الْحَمْدُ وَهُوَ عَلَى كُلِّ شَيْءٍ قَدِيرٌ، رَبِّ أَسْأَلُكَ خَيْرَ مَا فِي هَذَا الْيَوْمِ وَخَيرَ مَا بَعْدَهُ ، وَأَعُوذُ بِكَ مِنْ شَرِّ مَا فِي هَذَا الْيَوْمِ وَشَرِّ مَا بَعْدَهُ، رَبِّ أَعُوذُ بِكَ مِنَ الْكَسَلِ وَسُوءِ الْكِبَرِ، رَبِّ أَعُوذُ بِكَ مِنْ عَذَابٍ فِي النَّارِ وَعَذَابٍ فِي الْقَبْرِ",
      "arabicScript": "imlaei",
      "transliteration": "Aṣbaḥnā wa aṣbaḥa l-mulku li-llāhi wa-l-ḥamdu li-llāhi, lā ilāha illā llāhu waḥdahu lā sharīka lahu, lahu l-mulku walahu l-ḥamdu wahuwa ʿalā kulli shayʾin qadīrun, rabbi asʾaluka khayra mā fī hādhā l-yawmi wa khayra mā baʿdahu wa aʿūdhu bika min sharri mā fī hādhā l-yawmi washarri mā baʿdahu, rabbi aʿūdhu bika mina l-kasali wa sūʾi l-kibari, rabbi aʿūdhu bika min ʿadhābin fī an-nāri wa ʿadhābin fī l-qabr",
      "transliterationSource": "open-dua",
      "english": "We have entered the morning, and all sovereignty belongs to Allah. All praise is for Allah. None has the right to be worshipped except Allah alone, without partner. To Him belong all sovereignty and praise, and He has power over all things. My Lord, I ask You for the good of this day and what follows it. I seek refuge in You from the evil of this day and what follows it. My Lord, I seek refuge in You from laziness and the evils of old age. My Lord, I seek refuge in You from punishment in the Fire and punishment in the grave.",
      "englishSource": "open-dua",
      "repetition": {
        "count": 1,
        "instruction": null
      },
      "annotations": []
    },
    {
      "id": "recitation-2",
      "type": "recitation",
      "label": "Evening",
      "arabic": "أَمْسَيْنَا وَأَمْسَى الْمُلْكُ لِلَّهِ ، وَالْحَمْدُ لِلَّهِ، لاَ إِلَهَ إِلاَّ اللَّهُ وَحْدَهُ لاَ شَرِيكَ لَهُ، لَهُ الْمُلْكُ وَلَهُ الْحَمْدُ وَهُوَ عَلَى كُلِّ شَيْءٍ قَدِيرٌ، رَبِّ أَسْأَلُكَ خَيْرَ مَا فِي هَذِهِ اللَّيْلَةِ وَخَيرَ مَا بَعْدَهَا، وَأَعُوذُ بِكَ مِنْ شَرِّ مَا فِي هَذِهِ اللَّيْلَةِ وَشَرِّ مَا بَعْدَهَا، رَبِّ أَعُوذُ بِكَ مِنَ الْكَسَلِ وَسُوءِ الْكِبَرِ، رَبِّ أَعُوذُ بِكَ مِنْ عَذَابٍ فِي النَّارِ وَعَذَابٍ فِي الْقَبْرِ",
      "arabicScript": "imlaei",
      "transliteration": "Amsaynā wa amsā l-mulku li-llāhi wa-l-ḥamdu li-llāhi, lā ilāha illā llāhu waḥdahu lā sharīka lahu, lahu l-mulku walahu l-ḥamdu wahuwa ʿalā kulli shayʾin qadīrun, rabbi asʾaluka khayra mā fī hādhihi l-laylati wa khayra mā baʿdahā, wa aʿūdhu bika min sharri mā fī hādhihi l-laylati washarri mā baʿdahā, rabbi aʿūdhu bika mina l-kasali wa sūʾi l-kibari, rabbi aʿūdhu bika min ʿadhābin fī an-nāri wa ʿadhābin fī l-qabr",
      "transliterationSource": "open-dua",
      "english": "We have entered the evening, and all sovereignty belongs to Allah. All praise is for Allah. None has the right to be worshipped except Allah alone, without partner. To Him belong all sovereignty and praise, and He has power over all things. My Lord, I ask You for the good of this night and what follows it. I seek refuge in You from the evil of this night and what follows it. My Lord, I seek refuge in You from laziness and the evils of old age. My Lord, I seek refuge in You from punishment in the Fire and punishment in the grave.",
      "englishSource": "open-dua",
      "repetition": {
        "count": 1,
        "instruction": null
      },
      "annotations": []
    }
  ],
  "recordings": [
    {
      "id": "recording-1",
      "objectKey": "hisn/v0.0.2/OD-077-1.mp3",
      "durationSeconds": 78,
      "sampleRateHz": 24000,
      "reciter": "Muhammad Jumah",
      "covers": [
        "recitation-1"
      ]
    },
    {
      "id": "recording-2",
      "objectKey": "hisn/v0.0.2/OD-077-2.mp3",
      "durationSeconds": 83,
      "sampleRateHz": 24000,
      "reciter": "Muhammad Jumah",
      "covers": [
        "recitation-2"
      ]
    }
  ],
  "references": [
    {
      "id": "reference-1",
      "type": "source-note",
      "language": "ar",
      "citation": "وإذا أمسى قال: أمسينا وأمسى الملك للَّه."
    },
    {
      "id": "reference-2",
      "type": "source-note",
      "language": "ar",
      "citation": "وإذا أمسى قال: رب أسألك خير ما في هذه الليلة، وخير ما بعدها، وأعوذ بك من شر ما في هذه الليلة، وشر ما بعدها."
    },
    {
      "id": "reference-3",
      "type": "source-note",
      "language": "ar",
      "citation": "مسلم، 4/ 2088، برقم 2723."
    }
  ],
  "hadithGrades": [],
  "gradingNote": "Reference as printed in Hisn al-Muslim; grading pending review",
  "tags": [
    "hisn-al-muslim",
    "morning-and-evening",
    "protection-and-refuge"
  ],
  "reviews": {
    "source": {
      "status": "in-progress",
      "reviewer": null,
      "method": null,
      "date": null
    },
    "translation": {
      "status": "in-progress",
      "reviewer": null,
      "method": null,
      "date": null
    },
    "scholar": {
      "status": "not-started",
      "reviewer": null,
      "method": null,
      "date": null
    },
    "audio": {
      "status": "in-progress",
      "reviewer": null,
      "method": null,
      "date": null
    }
  },
  "revision": 2,
  "rightsProfile": "hisn-open-dua-modern",
  "textHash": "sha256:e25dee9c3847e5a58a63d3cf8837e755e6c09a268ee78cb68b5c873c46fd6227",
  "mediaHash": "sha256:5a4244862d0cef3e6dad275270fcc7931174fe01781e4a880855cd2d343b6668",
  "recordHash": "sha256:b28dbccb532a75e857a33c006503d67dd488445c60830c1dc6757c2305226f86"
}
